{
  "$schema": "./theme.schema.json",
  "schemaVersion": 1,
  "id": "crust-light",
  "name": "Crust Light · Precision",
  "author": "Pi-Crust",
  "version": "2.0.0",
  "variant": "light",
  "extends": null,
  "colors": {
    "background": "#F8F9F5", "chassis": "#D3D8D2", "displaySurface": "#191D1A", "displayText": "#F8F9F5", "signalWarning": "#F1B73A", "signalDanger": "#E6423A", "surface": "#F8F9F5", "surfaceElevated": "#E6E9DE",
    "overlay": "#5B4A3B66", "border": "#C3CABC", "borderStrong": "#818A7D",
    "textPrimary": "#191D1A", "textSecondary": "#5B4A3B", "textMuted": "#586253",
    "accent": "#0D703F", "accentContrast": "#F3F4EC", "focusRing": "#0D703F",
    "success": "#0D703F", "warning": "#805500", "danger": "#B42D26", "info": "#3C606A",
    "agentWorking": "#0D703F", "agentRetrying": "#805500", "agentCompacting": "#3C606A",
    "agentSettled": "#0D703F", "agentAwaitingUser": "#805500", "agentError": "#B42D26",
    "userBubble": "#E6E9DE", "thinking": "#5B4A3B",
    "diffAddedBg": "#DDEBDD", "diffAddedFg": "#0D703F",
    "diffRemovedBg": "#F3DDD5", "diffRemovedFg": "#9C2A24", "diffContextFg": "#586253"
  },
  "syntax": {
    "keyword": "#9C2A24", "string": "#0D703F", "number": "#805500", "comment": "#586253",
    "function": "#5B4A3B", "type": "#3C606A", "variable": "#252E28",
    "operator": "#5B4A3B", "punctuation": "#586253", "invalid": "#B42D26"
  },
  "typography": {
    "uiFontFamily": "SchibstedGrotesk", "headingFontFamily": "BarlowCondensed", "monoFontFamily": "SourceCodePro", "baseSize": 14,
    "scale": {"xs": 11, "sm": 12, "md": 14, "lg": 16, "xl": 20, "xxl": 28},
    "lineHeight": 1.55, "weights": {"regular": 400, "medium": 500, "semibold": 600}
  },
  "spacing": {"unit": 4, "scale": [0, 4, 8, 12, 16, 24, 32, 48]},
  "radii": {"sm": 2, "md": 2, "lg": 4, "pill": 999},
  "elevation": {"level1": {"color": "#252E2814", "blur": 16, "offsetY": 4}, "level2": {"color": "#252E2829", "blur": 32, "offsetY": 12}},
  "motion": {"fast": 120, "normal": 240, "slow": 240, "curve": "decisiveOut", "drawerCurve": "drawer"},
  "components": {"sidebar": {"background": "#D3D8D2", "width": 280}, "composer": {"background": "#F3F4EC", "minHeight": 112}, "toolCard": {"background": "#E6E9DE", "borderRadius": 4}}
}
