{
  "$schema": "./theme.schema.json",
  "schemaVersion": 1,
  "id": "piframe-dark",
  "name": "PiFrame Dark",
  "author": "PiFrame",
  "version": "1.0.0",
  "variant": "dark",
  "extends": null,
  "colors": {
    "background": "#161c27",
    "chassis": "#121721",
    "displaySurface": "#242e40",
    "displayText": "#f1f5f9",
    "signalWarning": "#f6bd53",
    "signalDanger": "#f1887a",
    "surface": "#1c2432",
    "surfaceElevated": "#242e40",
    "overlay": "#0f141fb3",
    "border": "#283549",
    "borderStrong": "#3d4e68",
    "textPrimary": "#f8fafc",
    "textSecondary": "#94a3b8",
    "textMuted": "#8696ab",
    "accent": "#5898bd",
    "accentContrast": "#0b1118",
    "focusRing": "#5898bd",
    "success": "#4ade80",
    "warning": "#f6bd53",
    "danger": "#f1887a",
    "info": "#5898bd",
    "agentWorking": "#4ade80",
    "agentRetrying": "#f6bd53",
    "agentCompacting": "#5898bd",
    "agentSettled": "#4ade80",
    "agentAwaitingUser": "#f6bd53",
    "agentError": "#f1887a",
    "userBubble": "#242e40",
    "thinking": "#81b2cf",
    "diffAddedBg": "#4ade8026",
    "diffAddedFg": "#4ade80",
    "diffRemovedBg": "#f1887a26",
    "diffRemovedFg": "#f1887a",
    "diffContextFg": "#94a3b8"
  },
  "syntax": {
    "keyword": "#5898bd",
    "string": "#4ade80",
    "number": "#f6bd53",
    "comment": "#94a3b8",
    "function": "#f1887a",
    "type": "#f6bd53",
    "variable": "#f8fafc",
    "operator": "#94a3b8",
    "punctuation": "#94a3b8",
    "invalid": "#f1887a"
  },
  "typography": {
    "uiFontFamily": "SchibstedGrotesk",
    "headingFontFamily": "BarlowCondensed",
    "monoFontFamily": "SourceCodePro"
  },
  "radii": {
    "sm": 6.0,
    "md": 10.0,
    "lg": 14.0,
    "pill": 999.0
  },
  "motion": {
    "fast": 120,
    "normal": 240
  }
}
